site,url,section,title,date,author,full_text
avgi.gr,https://www.avgi.gr/diethni/454475_o-atsalakotos-kyrios-royte,ΔΙΕΘΝΗ, Ο ατσαλάκωτος κύριος Ρούτε,2023-07-11T12:01:03+03:00,Κώστας Αργυρός,"Παρέμεινε στο τιμόνι των ολλανδικών κυβερνήσεων με εντελώς διαφορετικούς συνασπισμούς επί 13 συναπτά έτη, συναγωνιζόμενος σε μακροημέρευση σε αυτό το αξίωμα τον Βίκτορ Όρμπαν. Τώρα φαίνεται να χάνει οριστικά αυτή την άτυπη μονομαχία με τον Ούγγρο ομόλογό του. Ο Μαρκ Ρούτε οδήγησε ουσιαστικά σε διάλυση την κυβέρνησή του και θα παραμείνει ως υπηρεσιακός πρωθυπουργός μέχρι τις επόμενες πρόωρες εκλογές, πιθανότατα στα μέσα Νοεμβρίου. Αυτό που παραμένει ασαφές είναι αν τελικά θα ξαναηγηθεί του κεντροδεξιού κόμματος VVD, όπως αρχικά υπονόησε, ή αν πράγματι θα εγκαταλείψει την πολιτική, όπως υποστήριξε σε δεύτερο χρόνο. Αφορμή για τη διάλυση της κυβέρνησης ήταν η σκληρή στάση που αποφάσισε να υιοθετήσει στο θέμα του μεταναστευτικού, αρνούμενος να νομοθετήσει υπέρ της επανένωσης οικογενειών προσφύγων, κάτι που υποστήριξαν δύο από τα άλλα κυβερνητικά κόμματα, οι φιλελεύθεροι του D66 και οι καλβινιστές της Χριστιανικής Ένωσης. Μαζί με το Χριστιανοδημοκρατικό Κόμμα και το VVD του Ρούτε (Λαϊκό Κόμμα Ελευθερίας και Δημοκρατίας) συνέθεταν, έτσι κι αλλιώς, έναν μάλλον ετερόκλητο συνασπισμό, που ξεκίνησε το 2016 και άντεξε, παρά τις διαφωνίες, και μετά τις εκλογές του 2021. Πολλοί αναρωτιούνται τώρα γιατί ο ψυχρός υπολογιστής σε βαθμό κυνισμού και φανατικός νεοφιλελεύθερος πρωθυπουργός αποφάσισε να τραβήξει εν μέσω θέρους και με τη Βουλή σε διακοπές το σκοινί τόσο προς τα δεξιά. Άλλοι πιστεύουν ότι ο Ρούτε καλοβλέπει ένα διεθνές αξίωμα στην Κομισιόν ή τη θέση του γ.γ. του ΝΑΤΟ και επιδίωξε να κάνει ηρωική έξοδο, κάτι που ο ίδιος δημοσίως αρνείται. Κάποιοι άλλοι θεωρούν ότι ήθελε να στείλει ένα σαφές πολιτικό μήνυμα σε μια Ευρώπη που κινείται όλο και δεξιότερα για το πώς σχεδιάζει να κινηθεί το κόμμα του το επόμενο διάστημα. Κλασικός «τεχνικός της εξουσίας», ήταν ο πρώτος που συνεργάστηκε ανοιχτά με το ακροδεξιό Κόμμα της Ελευθερίας του Γκερντ Βίλντερς το 2010, έστω και με τη μορφή της κοινοβουλευτικής ανοχής από αυτό. Η άτυπη αυτή συνεργασία δεν του κόστισε τελικά, αφού στις επόμενες εκλογές, το 2012, το δικό του κόμμα εξήλθε πρώτο και ενδυναμωμένο. Αυτή τη φορά συνεργάστηκε με το σοσιαλδημοκρατικό Κόμμα της Εργασίας PvdA, κάτι που είχε καταστροφικά αποτελέσματα για το τελευταίο. Θυμηθείτε πώς εξαφανίστηκε από το προσκήνιο ο «σοσιαλιστής» Γερούν Ντάισελμπλουμ. Ακολούθησε έτσι η προαναφερθείσα τετρακομματική κυβέρνηση των τελευταίων 7 ετών. Αυτή τη φορά, πάντως, τα πράγματα θα είναι πιο περίπλοκα εξαιτίας της κατακόρυφης ανόδου μιας νέας πολιτικής δύναμης. Το Κίνημα Αγροτών Πολιτών, που είχε ιδρυθεί το 2019 και εκπροσωπείται από μία και μόνο βουλευτή, την αρχηγό του Καρολίνε φαν ντερ Πλας, σάρωσε στις περιφερειακές εκλογές του περασμένου Μαρτίου, πήρε 5 από τις 12 περιφέρειες και έχει πλέον τις περισσότερες έδρες στη Γερουσία. Τα προγνωστικά τού δίνουν προς το παρόν προβάδισμα και σε επίπεδο εθνικών εκλογών. Ουσιαστικά πρόκειται για ένα μόρφωμα που συσπείρωσε κινήσεις διαμαρτυρίας αγροτών, χωρίς ξεκάθαρη ιδεολογική ταυτότητα. Γιγαντώθηκε εξαιτίας της άρνησης των αγροτών να αποδεχτούν την περιοριστική νομοθεσία που προωθούσε η κυβέρνηση για τις εκπομπές αζώτου, αλλά στις συγκεντρώσεις τους συμμετείχαν τότε και άλλοι γενικώς διαμαρτυρόμενοι για κοινωνικά ζητήματα, ακόμα και αντιεμβολιαστές. Η ίδια η Φαν ντερ Πλας δήλωνε για τη στάση της στη Βουλή: «Όταν ψηφίζουμε, κινούμαστε προς τα δεξιά, αλλά στην κοινωνική πολιτική είμαστε πιο αριστερά». Κινητικότητα υπάρχει, πάντως, και στην ίδια την Αριστερά. Τα δύο βασικά της κόμματα, το σοσιαλδημοκρατικό PvdA και η Πράσινη Αριστερά, συζητούν σοβαρά το ενδεχόμενο κοινής καθόδου στις εκλογές, ελπίζοντας να προσφέρουν μια εναλλακτική στον παραδοσιακό, αλλά ξεθωριασμένο ολλανδικό νεοφιλελευθερισμό. Ο ηγέτης της τελευταίας Τζέσε Κλάβερ χαρακτήρισε αυτές τις μέρες του 2023 «σημείο καμπής» για τη χώρα και την Αριστερά. Ο 37χρονος και αρκετά δημοφιλής πολιτικός γνωρίζει, πάντως, ότι οι μέχρι τώρα δημοσκοπήσεις δίνουν και στα δύο κόμματα μαζί ένα ποσοστό γύρω στο 15%. Είναι ένα ζήτημα πόσο συσπειρωτικά θα μπορούσε να λειτουργήσει η συνεργασία τους, ώστε να γίνει πράξη κάποια στιγμή το όνειρο της Άτγιε Κούικεν, επικεφαλής των Σοσιαλδημοκρατών για μια αριστερή πλειοψηφία και κυβέρνηση. Προς το παρόν, η πολιτική ζυγαριά γέρνει εμφανώς προς τα δεξιά."
avgi.gr,https://www.avgi.gr/tehnes/450809_peri-bibliothikon-sylloges,ΤΕΧΝΕΣ, Περί βιβλιοθηκών... συλλογές,2023-06-12T17:30:11+03:00,Καλλίμαχος,"Εχουμε παρουσιάσει από τη στήλη τους περασμένους μήνες διάφορες περιπτώσεις προσπάθειας λογοκρισίας σε συλλογές βιβλιοθηκών στις ΗΠΑ, στην Ιρλανδία αλλά και αλλού. Προσπάθειες από μικρές ομάδες ανθρώπων που τους ενοχλούν τα ζητήματα ισότητας, συμπερίληψης, αποδοχής, αλλά και εντέλει γνώσης, επιστήμης και πληροφορίας. Κινήματα που κινούνται προς διάφορες κατευθύνσεις και περιλαμβάνουν στους κόλπους τους από αντιεμβολιαστές μέχρι ομοφοβικούς. Μάλιστα, σε κάποιες περιπτώσεις, όπως αυτή της Ιρλανδίας, οι δράσεις αυτών των ομάδων επεκτείνονται μέχρι και του σημείου να εισέρχονται στις βιβλιοθήκες και να βιντεοσκοπούν τους εργαζόμενους την ώρα που αυτοί προσπαθούν να αποτρέψουν τους βανδαλισμούς και στη συνέχεια να διαθέτουν αυτό το υλικό στο Διαδίκτυο, στοχοποιώντας έτσι τόσο τις συλλογές όσο και τους εργαζόμενους στις βιβλιοθήκες. Η πρόεδρος της IFLA (Παγκόσμια Ομοσπονδία Ενώσεων Βιβλιοθηκών) Μπάρμπαρα Λάιζον προχώρησε στη διατύπωση δημόσιας δήλωσης σχετικά. Μεταξύ των άλλων, υπογραμμίζει ότι «οι βιβλιοθήκες είναι η πύλη για τη γνώση (...) υποστηρίζουν την ελευθερία του λόγου, η οποία είναι ζωτική τόσο για τα άτομα όσο και για την κοινωνική ανάπτυξη, τη δημιουργικότητα και τη στήριξη των ανθρωπίνων δικαιωμάτων». Για την IFLA, η επιλογή και η διάθεση του υλικού της βιβλιοθήκης υπόκειται σε επαγγελματικές αποφάσεις και όχι σε πολιτικές, ηθικές ή θρησκευτικές αντιλήψεις. Είναι κρίσιμο την επιλογή του υλικού να την κάνουν επαγγελματίες με καθαρό μυαλό και κριτική αντίληψη, για να μπορούν να προσφέρουν στην κοινότητά τους το μεγαλύτερο δυνατό εύρος της ανθρώπινης σκέψης και δημιουργικότητας. Και είναι εξίσου σημαντικό τα μέλη της κοινότητας να έχουν ανεμπόδιστη πρόσβαση προς το υλικό που διατίθεται (με πολύ συγκεκριμένους περιορισμούς - για παράδειγμα, η ηλικία). Είναι επίσης κρίσιμο ο καθένας που επισκέπτεται μια βιβλιοθήκη να μπορεί να νιώσει πως είναι μέρος της, βρίσκοντας στις συλλογές της υλικό που σχετίζεται με τα ενδιαφέροντά του και τις ιδιαιτερότητές του. Η συλλογή οφείλει να είναι χτισμένη με φροντίδα για τα μέλη της, για τους ανθρώπους που θα τη χρησιμοποιήσουν, επιτρέποντας ακριβώς «όλα τα λουλούδια να ανθίσουν» στα ράφια της. Δείκτες δημοκρατίας, έχουμε γράψει τακτικά. Μοχλοί οικονομικής, κοινωνικής και πολιτιστικής ανάπτυξης, θα σημειώσουμε τώρα. Και όλοι αυτοί οι ρόλοι επιτυγχάνονται κυρίως μέσα από την ίδια την ουσία των βιβλιοθηκών, δηλαδή των συλλογών τους. Λογοκρισία οποιουδήποτε είδους και μορφής, απαγορευμένο ή ακατάλληλο υλικό, αποφάσεις για το περιεχόμενο της συλλογής από εξωθεσμικούς φορείς είναι επικίνδυνα. Για την εκπαίδευση, την παιδεία, την έρευνα, τον πολιτισμό, την κοινωνική συμμετοχή, την κριτική σκέψη, τη συμπερίληψη και τελικά για την οικονομική και κοινωνική ανάπτυξη. Ας υπερασπιστούμε τις βιβλιοθήκες μας υπερασπιζόμενοι τους βιβλιοθηκονόμους σ’ αυτές και τον τρόπο με τον οποίο χτίζουν τις συλλογές τους.  "
avgi.gr,https://www.avgi.gr/politiki/446755_paraskinio-tis-diaspasis-tis-akrodexias-oi-kaygades-kai-oi-aytoforakides,ΠΟΛΙΤΙΚΗ, Εκλογές 2023 / Το παρασκήνιο της διάσπασης της ακροδεξιάς - Οι καυγάδες και οι «αυτοφωράκηδες» ,2023-05-01T15:29:10+03:00,Γιάννης Ανδρουλιδάκης,"Στις 20 Φεβρουαρίου 1933, στην Καγκελαρία του Ράιχ στο Βερολίνο έγινε μια από τις πιο σημαντικές συναντήσεις στη σύγχρονη Ιστορία. O πρόεδρος του Ράιχσταγκ Χέρμαν Γκέρινγκ και ο διαβόητος βιομήχανος και μέλος του ναζιστικού κόμματος Γουστάβος Κρουπ φρόντισαν να συγκεντρωθούν 25 Γερμανοί βιομήχανοι -μεταξύ των οποίων θα συναντούσε κανείς τους ιδιοκτήτες της Όπελ, της Ζίμενς και τον επικεφαλής της Τράπεζας της Γερμανίας- και να συναντήσουν τον Χίτλερ. Σκοπός της συνάντησης, να διασφαλιστεί η χρηματοδότηση των ναζί από το γερμανικό κεφάλαιο, ώστε να σταθεροποιηθεί η κατάσταση στη χώρα και να απομακρυνθεί ο κίνδυνος μιας κυβέρνησης συνεργασίας μεταξύ Σοσιαλιστών και Κομμουνιστών. Ευτυχώς, η απόπειρα εκπροσώπων του εθνικού κεφαλαίου στην Ελλάδα και εκπροσώπων των διάφορων τάσεων της ελληνικής Ακροδεξιάς να δημιουργήσουν μια ρέπλικα αυτής της συνάντησης, την περασμένη Τρίτη, πιθανότατα στο σπίτι του σχετιζόμενου με το κατασκευαστικό κεφάλαιο επιχειρηματία Πρόδρομου Εμφιετζόγλου, απέτυχε παταγωδώς, παραπέμποντας στον γνωστό αφορισμό περί της επανάληψης της Ιστορίας με τη μορφή φάρσας. Η βασική ιδέα που τέθηκε για αυτή τη συνάντηση, η οποία διέρρευσε μάλλον πρόθυμα στο δημοσιογραφικό περιβάλλον, ήταν να παρουσιαστεί ένα ενιαίο κόμμα της ελληνικής Ακροδεξιάς, το οποίο θα περιλάμβανε το σύνολο -σχεδόν- των φυλών της και θα απέφευγε τους σκοπέλους των απαγορεύσεων που προβλέπονται με βάση την υπάρχουσα νομοθεσία. Στα ονόματα που είχαν διαρρεύσει ότι είχαν προσκληθεί σε αυτή τη συνάντηση και επρόκειτο να συμμετάσχουν περιλαμβάνονταν αυτά του απερχόμενου βουλευτή Κ. Μπογδάνου, του πρώην βουλευτή της Ν.Δ. Ν. Νικολόπουλου, του καθηγητή Φαρμακολογίας Δ. Κούβελα και του γιατρού Θ. Βόβολη από την τάση των αντιεμβολιαστών, του πάλαι ποτέ υπαρχηγού του μακαρίτη Γιώργου Τράγκα, Πάρη Κουρτζίδη, του αρχικά δηλωμένου «αυτοφωράκια» του Κασιδιάρη, πρώην εισαγγελέα Αναστάσιου Κανελλόπουλου και ακόμα ενός εκπροσώπου του Κασιδιάρη. Σε «πολιτικό», δηλαδή, επίπεδο, περιλαμβανόταν ένα κομμάτι που ξεκινούσε από τις παρυφές της Ν.Δ. και έφτανε μέχρι τον καταδικασμένο ναζιστή εγκληματία Κασιδιάρη, αφήνοντας έξω μόνο τη σύμπραξη του Φαήλου Κρανιδιώτη με τον Τζήμερο και τα υπόλοιπα θραύσματα της άλλοτε κραταιής Χρυσής Αυγής - αυτό που κράτησε τη νομιμοφροσύνη του προς τον Ν. Μιχαλολιάκο και εκείνο που συντάχθηκε με τον Λαγό. Όχι τυχαία, αφού το μεν δίδυμο Φαήλου-Τζήμερου θεωρείται από όλους τους υπόλοιπους ως «νεοδημοκράτες με πολιτικά», ενώ ο Κασιδιάρης δεν θέλει να συνομιλεί με όσους αμφισβητούν ότι είναι ο κληρονόμος των ναζιστικών ερειπίων. Από επιχειρηματική σκοπιά, πέραν του Πρόδρομου Εμφιετζόγλου, που είχε ήδη ιδρύσει ένα κόμμα και είχε προσλάβει σε αυτό και τον Μπογδάνο, ο οποίος δεν διάγει την καλύτερη επιχειρηματικά εποχή του εδώ και χρόνια, ακουγόταν έντονα το όνομα του προέδρου του μπασκετικού Παναθηναϊκού και ιδιοκτήτη της φαρμακοβιομηχανίας ΒΙΑΝΕΞ Δ. Γιαννακόπουλου. Ο Γιαννακόπουλος, που είχε στο παρελθόν τοποθετηθεί υπέρ της Λεπέν στη Γαλλία και του Τραμπ στις ΗΠΑ, μιλά ανοιχτά για την υποστήριξή του στον Κασιδιάρη. Μάλιστα, η στήριξη του φαρμακοβιομήχανου στον Κασιδιάρη ήταν, σύμφωνα με πληροφορίες, αυτή που τον κράτησε «ζωντανό» στη διαπραγμάτευση, παρά τις αντιρρήσεις κάποιων άλλων καλεσμένων, που δεν ήθελαν να εμπλακούν με τον φυλακισμένο ναζί, και έθεταν το ζήτημα της απαγόρευσης, που μπορούσε να τους ακουμπήσει και αυτούς, όπως και, αντίθετα, τη δυνατότητα να εκμεταλλευτούν για λογαριασμό τους τον ενδεχόμενο αποκλεισμό του πρώην χρυσαυγίτη. Η ρήξη του Κασιδιάρη με τον Κανελλόπουλο στα τέλη της περασμένης εβδομάδας ήταν το πρώτο ρήγμα σε αυτό το υπό κατασκευή φασιστικό μέτωπο. Ο πρώην εισαγγελέας ενόχλησε τον καταδικασμένο ναζί καθώς έδειξε να παίρνει στα σοβαρά τις δηλώσεις του ότι δεν είναι φερέφωνο κανενός και άρχισε να διαπραγματεύεται για λογαριασμό του, στο όνομα του μορφώματος του Κασιδιάρη - το οποίο μία εβδομάδα πριν τον είχε «εκλέξει»… πρόεδρο. Ο καβγάς μεταξύ των δύο, που αρχικά προκάλεσε ερωτήματα σχετικά με το αν ήταν πραγματικός, είχε ως αποτέλεσμα, όπως φαίνεται, πολλαπλασιαστικές διασπάσεις, καθώς ανασχημάτισε τις προσωπικές φιλοδοξίες καθενός από τους φασίστες. Ετσι, τη μέρα που η Ακροδεξιά θα αναγεννιόταν -σχεδόν- ενιαία, κατέληξε, αντίθετα, να βλέπει τα διαφορετικά της βλήματα να μετατρέπονται σε θραύσματα που πετιόνταν από εδώ και από εκεί. Ο Κασιδιάρης ανακοίνωσε καινούργιο «αυτοφωράκια», που αυτή τη φορά δεν προερχόταν από τον δικαστικό, αλλά από τον στρατιωτικό χώρο, τον ταξίαρχο ε.α. Δ. Χατζηλιάδη, εκπαιδευτή της Σχολής Ευελπίδων. Το ρεύμα των παλαιοδεξιών, όπως ο Νικολόπουλος και ο Κουρτζίδης, αναζήτησαν τη δυνατότητα συμμαχίας με τον εισαγγελέα Κανελλόπουλο, καταλήγοντας όμως γρήγορα στο συμπέρασμα ότι ο τελευταίος ήταν ασταθής προσωπικότητα. Οι αντιεμβολιαστές αποφάσισαν να τραβήξουν τον δικό τους δρόμο, απευθυνόμενοι σε λιγότερο ιδεολογικοποιημένα κοινά, ενώ το δίδυμο Εμφιετζόγλου-Μπογδάνου πέρασε τη δική του εσωτερική κρίση, η οποία λέγεται ότι είχε ως αιτία την αναζήτηση ισχυρότερου χρηματοδότη από τον άλλοτε νιουσκάστερ του ΣΚΑΪ. Οι δύο άνδρες είπαν να ξεπεράσουν τις διαφωνίες τους, πλην όμως το κόμμα τους απορρίφθηκε με συνοπτικές διαδικασίες από τον Άρειο Πάγο. Μ’ αυτά και μ’ αυτά, στις εκλογές της 21ης Μαΐου θα κατέβουν ούτε ένα ούτε δύο, αλλά 18 ακροδεξιοί συσχετισμοί, συμπεριλαμβανομένης της Ελληνικής Λύσης του Βελόπουλου, που πέρασε τη δική της κρίση την περασμένη εβδομάδα, του κόμματος της γραφικής ακροδεξιάς περσόνας Λατινοπούλου, αλλά και του Σώρρα, που εξακολουθεί να μοιράζει τρισεκατομμύρια. Το αποτέλεσμα αυτής της πολυδιάσπασης είναι σαφές: Το πιο ισχυρό και στιβαρό κομμάτι της Ακροδεξιάς δεν χρειάζεται να το ψάχνει κανείς στα περίεργα ψηφοδέλτια. Θα είναι, για ακόμα μία φορά, ενσωματωμένο στη Νέα Δημοκρατία."
